timestamp	round	experiment_id	strategy	stage	decision	improvement_pct	baseline_score	experiment_score	avg_steps	avg_food	peak_length	snake_death_rate	description
2026-04-03T13:49:17.803581	7550	d0ab58f4	radical	4	keep	0.2972	1.3	1.7	517	146	43	0.499	[radical] S4/MASS_MANAGEMENT: food_shaping: 0.0567 -> 0.0570; gamma: 0.9581 -> 0.9203; wall_proximity_penalty: 0.2953 -> 0.2297; max_steps: 2240 -> 2651; death_snake: -59.8643 -> -71.1186
2026-04-03T13:49:26.204366	7551	beb14793	radical	4	keep	0.2972	1.3	1.7	517	146	43	0.499	[radical] S4/MASS_MANAGEMENT: death_snake: -71.1186 -> -63.3446; mass_loss_penalty: 1.8492 -> 1.7528; max_steps: 2651 -> 2526; survival_escalation: 0.0042 -> 0.0055; enemy_alert_dist: 2679 -> 3225
2026-04-03T13:49:34.570185	7552	b0793d15	explore	1	keep	0.6139	1.3	2.1	517	146	43	0.499	[explore] S1/FOOD_VECTOR: gamma: 0.8421 -> 0.8545; food_reward: 1.0000 -> 1.0717; death_snake: -11.5076 -> -12.5361
2026-04-03T13:49:42.950498	7553	194bc3c4	explore	1	keep	0.6139	1.3	2.1	517	146	43	0.499	[explore] S1/FOOD_VECTOR: food_reward: 1.0717 -> 1.0141; gamma: 0.8545 -> 0.8458; wall_proximity_penalty: 0.0324 -> 0.0239
2026-04-03T13:49:51.305426	7554	8dbe8e70	explore	1	keep	0.6139	1.3	2.1	517	146	43	0.499	[explore] S1/FOOD_VECTOR: death_wall: -13.9503 -> -14.7827; wall_proximity_penalty: 0.0239 -> 0.0331; gamma: 0.8458 -> 0.8467
2026-04-03T13:49:59.684660	7555	d6e61b44	tweak	2	keep	1.0716	1.3	2.7	517	146	43	0.499	[tweak] S2/WALL_AVOID: survival_escalation: 0.0074 -> 0.0073
2026-04-03T13:50:08.049126	7556	ef2551e4	radical	1	keep	0.6139	1.3	2.1	517	146	43	0.499	[radical] S1/FOOD_VECTOR: death_snake: -12.5361 -> -8.3467; wall_proximity_penalty: 0.0331 -> 0.0262; food_reward: 1.0141 -> 1.0000; max_steps: 560 -> 607; gamma: 0.8467 -> 0.8265
2026-04-03T13:50:16.423372	7557	e7ac1b55	explore	3	keep	4.2756	1.3	6.9	517	146	43	0.499	[explore] S3/ENEMY_AVOID: death_wall: -5 -> -6.204458900241613; enemy_approach_penalty: 0.6948 -> 0.8866; starvation_grace_steps: 42 -> 38
2026-04-03T13:51:25.128101	7559	43ce981f	radical	2	keep	1.0716	1.3	2.7	517	146	43	0.499	[radical] S2/WALL_AVOID: max_steps: 323 -> 287; death_snake: -18.8670 -> -14.4269; starvation_penalty: 0.0057 -> 0.0092; survival_escalation: 0.0073 -> 0.0100; food_shaping: 0.0833 -> 0.0723
2026-04-03T13:51:33.471208	7560	65c22c89	explore	1	keep	0.6139	1.3	2.1	517	146	43	0.499	[explore] S1/FOOD_VECTOR: death_snake: -8.3467 -> -8.0149; gamma: 0.8265 -> 0.8243; survival: 0.0349 -> 0.0346
2026-04-03T13:51:41.833758	7561	5ef8766f	explore	1	keep	0.6139	1.3	2.1	517	146	43	0.499	[explore] S1/FOOD_VECTOR: survival: 0.0346 -> 0.0404; wall_proximity_penalty: 0.0262 -> 0.0358; gamma: 0.8243 -> 0.8038
2026-04-03T13:51:50.222321	7562	36d0fe60	tweak	5	keep	0.1219	1.3	1.5	517	146	43	0.499	[tweak] S5/MASTERY_SURVIVAL: enemy_approach_penalty: 0.1043 -> 0.1034
2026-04-03T13:51:58.623572	7563	30dbf294	radical	5	keep	0.1219	1.3	1.5	517	146	43	0.499	[radical] S5/MASTERY_SURVIVAL: kill_opportunity_reward: 7.8312 -> 10.5263; death_wall: -27.6908 -> -23.6640; contest_food_reward: 2.8192 -> 0.9186; enemy_proximity_penalty: 1.4243 -> 1.7712; enemy_alert_dist: 1471 -> 1329
2026-04-03T13:54:07.630651	7566	02215ff4	tweak	1	keep	0.6139	1.3	2.1	517	146	43	0.499	[tweak] S1/FOOD_VECTOR: death_wall: -14.7827 -> -12.9976
2026-04-03T13:54:15.962558	7567	11d35656	explore	3	keep	4.2756	1.3	6.9	517	146	43	0.499	[explore] S3/ENEMY_AVOID: starvation_penalty: 0.0011 -> 0.0014; starvation_grace_steps: 38 -> 48; death_wall: -6.2045 -> -5.2937
2026-04-03T13:54:24.290236	7568	a0f980ce	explore	3	keep	4.2756	1.3	6.9	517	146	43	0.499	[explore] S3/ENEMY_AVOID: gamma: 0.9039 -> 0.9291; death_snake: -44.2153 -> -42.1862; enemy_proximity_penalty: 1.2639 -> 1.1236
2026-04-04T02:25:32.907772	7570	84af41ed	radical	1	keep	0.4422	1.3	1.9	425	122	39	0.408	[radical] S1/FOOD_VECTOR: wall_proximity_penalty: 0.0358 -> 0.0376; survival: 0.0404 -> 0.0458; death_snake: -8.0149 -> -10.9736; max_steps: 607 -> 427
2026-04-04T22:12:16.891028	7571	745c29fa	tweak	5	discard	-0.0338	1.3	1.3	426	122	39	0.408	[tweak] S5/MASTERY_SURVIVAL: food_reward: 3.8784 -> 4.2136
2026-04-04T23:06:39.937772	7572	381aa5a9	radical	5	discard	-0.0387	1.3	1.2	427	122	39	0.416	[radical] S5/MASTERY_SURVIVAL: food_shaping: 0.0927 -> 0.1276; wall_proximity_penalty: 0.3813 -> 0.5390; gamma: 0.9950 -> 0.9764; death_snake: -31.6877 -> -41.6929; enemy_approach_penalty: 0.1034 -> 0.0766
2026-04-05T11:36:46.877864	7573	fee12927	tweak	2	keep	0.5501	1.3	2.0	361	106	40	0.385	[tweak] S2/WALL_AVOID: gamma: 0.8000 -> 0.8093
2026-04-06T00:06:53.347548	7574	7923f655	tweak	1	keep	0.1120	1.3	1.4	369	106	38	0.419	[tweak] S1/FOOD_VECTOR: max_steps: 427 -> 389
2026-04-06T01:30:49.600067	7575	b62f1ac9	tweak	4	discard	0.0083	1.3	1.3	381	109	38	0.445	[tweak] S4/MASS_MANAGEMENT: enemy_approach_penalty: 0.1435 -> 0.1546
